<?xml version="1.0" encoding="utf-8" standalone="no"?>

<!DOCTYPE messberichte SYSTEM "messberichte.dtd">

<messberichte>
    <!-- Messbericht-Nr und Datum fuer den Messbericht hier ergaenzen -->
    <messbericht nr="_1" datum="15.10.2024">
        <kopfdaten>
            <arbeitszeit dimension="_Stunden">4.5</arbeitszeit>
            <artikeldaten>
                <artikel artikel_id="_wz-123-876">
                    <zeichnungs_nr> tpb7012578-v01 </zeichnungs_nr>
                    <art_bezeichnung>CPU-Kühlkörper A1</art_bezeichnung>
                </artikel>
            </artikeldaten>
            <lieferantendaten>
                <lieferanten Lieferanten_id="2323">
                    <lieferant> Schenker</lieferant>
                </lieferanten>
            </lieferantendaten>
            <prueferdaten>
                <pruefplandaten ppl_id="wz-123-876-ppl1" />
            </prueferdaten>

        </kopfdaten>
        <messwertdaten>
            <pruefmerkmal pm_name="Länge-a" pm_dimension="mm">
                <pm_wert lfd_nr="001">50.12</pm_wert>
                <pm_wert lfd_nr="002">50.01</pm_wert>
                <pm_wert lfd_nr="003">49.98</pm_wert>
                <pm_mittelwert>50.04</pm_mittelwert>
            </pruefmerkmal>
            <pruefmerkmal pm_name="Gesamtmasse" pm_dimension="g">
                <pm_wert lfd_nr="001">210.3</pm_wert>
                <pm_wert lfd_nr="002">209.8</pm_wert>
                <pm_wert lfd_nr="003">208.9</pm_wert>
                <pm_mittelwert>209.7</pm_mittelwert>
            </pruefmerkmal>
        </messwertdaten>
        <prueferergebnis>
            <einstufung einstufung="nacharbeit">
            </einstufung>
            <bemerkung></bemerkung>
            <nacharbeitstermin></nacharbeitstermin>
        </prueferergebnis>
    </messbericht>
</messberichte>


<!-- IDs müssen immer _ davor haben
 zb. _01-->
<!-- in der Aufgabe steht aber diesmal, dass es nur eine ID geben darf und deshalb bekommt der Rest
statt ID ein CDATA-->